"","title","price","sold_at","username","bought_and_sold","designer","sold_price","interval"
"817","(M) RSVP Pop Up Hoodie ASSC Anti Social Social Club x RSVP GALLERY",144,2019-03-13 22:44:48,"SUPAHFAI",2414,"Rsvp Gallery",152,10
"949","Wallet - Guccissima Leather",132,2019-03-13 22:48:31,"pure_luxury",358,"Gucci",105,10
"946","NEW Adidas X Kith NYC",105,2019-03-13 22:57:34,"YouNeedKITH",89,"Adidas",115,10
"787","Supreme Band Aid SS19 - Pack of 20 Bandages",18,2019-03-13 23:01:50,"Huyquach",2,"Supreme",26,10
"979","Human Made Logo Shoulder Tote Bag Special Book By Nigo",81,2019-03-13 23:04:54,"D3m0liti0n_Man",46,"Human Made",68,10
"740","Authentic Louis Vuitton Wallet",250,2019-03-13 23:18:18,"BathingCJ",6,"Louis Vuitton",225,10
"980","Spell Out Gold Necklace",108,2019-03-13 23:29:46,"wpleasant98",77,"Dior",115,10
"696","FTP X FOULPLAY LOGO PULLOVER HOODIE BLACK",140,2019-03-13 23:47:04,"hod",60,"Fuck The Population",120,10
"768","Anti Social Social Club Black Tee M",46,2019-03-13 23:47:50,"NECKONFROZE",402,"Antisocial Social Club",56,10
"807","Yours Truly Tee Napoleon Dynamite Trisha",60,2019-03-13 23:57:20,"GrailsOnly",191,"Golf Wang",70,10
"728","NEED GONE‼️ZURICH CUT AND SEWN LONGSLEEVE",387,2019-03-13 23:58:38,"thefinessesta",247,"Vetements",417,10
"692","Rhude",180,2019-03-14 00:06:34,"FlexersShop",2,"Rhude",220,10
"770","Scum Fuck Flower Boy Button Up",166,2019-03-14 00:19:44,"gracekollek",3,"Golf Wang",196,10
"735","Yeezus Tour Red Kanye Ski Mask",64,2019-03-14 00:22:47,"Jawnbitz",117,"Vintage",74,10
"937","UNDERCOVER x Uniqlo Undercover UU Big U by Jun Takahashi Spell Out Big U Logo Cotton Tee Shirt Rare Cutting Size XL",49,2019-03-14 00:50:44,"EnchekPrelovedOutlet",65,"Undercover",40,10
"846","Baby Milo Camo Bape Tee",90,2019-03-14 00:52:51,"ajboehler1",2,"Bape",100,10
"685","FTP Fuct All Over Print Hoodie",300,2019-03-14 00:57:02,"clowner12329",173,"Fuck The Population",305,10
"970","Liberated Wool Peacoat",240,2019-03-14 01:09:01,"guywilliams",51,"Outlier",270,10
"823","Supreme Chenille Hooded Sweatshirt /Red/Large/ Week 1 SS19",241,2019-03-14 01:12:37,"Georgemotola",1,"Supreme",249,10
"783","Supreme Shoulder Bag “Olive” SS19",115,2019-03-14 01:14:35,"JaviP96",192,"Supreme",100,10
"704","Supreme KRS One/BDP Any Means Tee White LARGE",60,2019-03-14 01:17:04,"dnSreme",39,"Supreme",60,10
"800","Archive Yohji Yamamoto for Men Wood Colour Hemp Gabardine Ballon Trousers Pants",518,2019-03-14 01:17:36,"AvantGardism",657,"Yohji Yamamoto",330,10
"679","NUMBER (N)INE COTTON SWEAT HOODIE SIZE 2",54,2019-03-14 01:25:09,"mooncat0404",450,"Number (N)ine",85,10
"680","NUMBER (N)INE DENIM SIZE 2",54,2019-03-14 01:25:41,"mooncat0404",451,"Number (N)ine",80,10
"755","Supreme waist bag S/S19",90,2019-03-14 01:37:19,"lalea",41,"Supreme",105,10
"914","Air Jordan 6 Black ""Infared"" Size 10",70,2019-03-14 01:41:37,"SS007",2,"Jordan Brand",78,10
"701","ANTI SOCIAL SOCIAL CLUB MELROSE AVE . CAMO HOODIE L",111,2019-03-14 01:47:56,"NECKONFROZE",403,"Antisocial Social Club",121,10
"726","Supreme Waist Bag Black SS19",110,2019-03-14 01:49:40,"d24morgan",25,"Supreme",105,10
"713","bape",97,2019-03-14 01:50:31,"diszley",48,"Bape",100,10
"727","3A-MZ3 Foil Black (Pair)",250,2019-03-14 01:50:50,"REN13",8,"Acronym",258,10
"818","(M) White Turbo 911 Hoodie ASSC Anti Social Social Club x NEIGHBORHOOD",144,2019-03-14 01:53:45,"SUPAHFAI",2414,"Neighborhood",164,10
"952","Balenciaga White triple s Clear Sole Trainers",500,2019-03-14 02:42:19,"humansocietyco",39,"Balenciaga",520,10
"923","🔥Iconic Versace Transformer 2 in 1 Light Jacket/Vest Track",181,2019-03-14 02:55:35,"archive2000",1295,"Versace",175,10
"741","Supreme Leda And The Swan Tee",60,2019-03-14 03:00:55,"antismart",7,"Supreme",60,10
"663","Nike Blazer off white grim reaper",300,2019-03-14 03:13:01,"Martinperez01",1,"Nike",330,10
"673","Sample crewneck",450,2019-03-14 03:16:56,"garconahommeV2",33,"Enfants Riches Deprimes",460,10
"992","17 xxxtentacion hoodie",75,2019-03-14 03:31:15,"vermontnurse",91,"Revenge",110,10
"698","Supreme Center Piece Hoodie White Size XL",180,2019-03-14 03:43:18,"sendmeshmeckles",7,"Supreme",125,10
"953","By the fireplace",72,2019-03-14 04:09:39,"matthewantoniak",13,"Maison Margiela",68,10
"645","Artisanal Bullet Necklace (0) (10)",297,2019-03-14 04:21:10,"robinpetry",112,"Maison Margiela",250,11
"938","[final price] Gucci knight black leather jacket",356,2019-03-14 04:39:16,"bogdanian",97,"Gucci",381,11
"945","Rare JPG Jean Paul Gaultier London Art Shirt Paisley Comme Des Junya",50,2019-03-14 04:40:57,"mohamadafiq2103",50,"Jean Paul Gaultier",75,11
"665","Supreme new Era RIP 7 1/2 fitted hat",50,2019-03-14 04:49:55,"shayyyali",25,"Supreme",55,11
"667","ASSC x UNDFTD Paranoid Tee L",54,2019-03-14 05:08:48,"IzukuThreads",447,"Undefeated",79,11
"841","Rare Bape X Kaws Ringer Tshirt",135,2019-03-14 05:16:03,"Cakk",20,"Bape",145,11
"767","Mountain jacket",60,2019-03-14 05:20:38,"stpierrejulien",18,"Wings + Horns",50,11
"887","Travis Scott Astroworld Hoodie",150,2019-03-14 05:36:16,"XJavierhX",2,"Travis Scott",125,11
"816","(S) Gran Turismo Tee ASSC Anti Social Social Club",72,2019-03-14 05:45:56,"SUPAHFAI",2415,"Antisocial Social Club",80,11
"725","100% Authentic 2012 Nike Air Jordan White Cement 4",94,2019-03-14 05:50:33,"kenoxner",69,"Nike",104,11
"697","Vetements Unskinny Purple Sweatshirt",300,2019-03-14 05:57:35,"castles",3,"Vetements",325,11
"739","Yeezy 350 Blue Tint",181,2019-03-14 05:58:52,"chikapika1",54,"Adidas",225,11
"763","Palace Bunning Bulldog Crew",102,2019-03-14 06:09:46,"king_dorito",171,"Palace",110,11
"633","🔥[Need Gone Today] Prada Vela Black Nylon Backpack",405,2019-03-14 06:21:55,"RichMan",407,"Prada",200,11
"648","Alexander Wang x Adidas Zipper",67,2019-03-14 06:28:41,"plssmtnew",5,"Adidas",65,11
"658","CalvinKlein205",600,2019-03-14 06:36:46,"cecchettialberto30",4,"Calvin Klein 205W39NYC",600,11
"662","Nike off white air max 90 desert",320,2019-03-14 06:37:06,"Martinperez01",2,"Nike",300,11
"624","black tape crew neck",200,2019-03-14 06:45:12,"caeleighncope",2,"Vetements",200,11
"659","Mustang Glasses",145,2019-03-14 06:45:45,"macisbrazy45",16,"Acne Studios",145,11
"921","School of Visual Comedy Tee in White",144,2019-03-14 07:01:39,"sikkay",274,"Number (N)ine",152,11
"687","Supreme Band Aids 4 boxes",55,2019-03-14 07:21:38,"poteathoratio",78,"Supreme",62,11
"915","Supreme Yankees Towel",90,2019-03-14 07:26:53,"MaxPer",16,"Supreme",100,11
"796","Supreme Band Aid SS19 & Shower Cap",20,2019-03-14 07:31:07,"niktab5",10,"Supreme",20,11
"942","Asspizza Beanie",48,2019-03-14 07:31:09,"supremek15",55,"Asspizza",58,11
"961","Amiri Broken Jean Aged Black",625,2019-03-14 07:32:51,"closetflee",2,"Amiri",675,11
"907","TEXTURED LEATHER BELT",380,2019-03-14 07:43:36,"nadineclothing",602,"Ma+",355,11
"654","Saint Laurent Paris Gray University Teeshirt Size XL Brand New",199,2019-03-14 07:44:38,"KINGS_SHOPPER",880,"Saint Laurent Paris",180,11
"984","Supreme Fanny Pack",121,2019-03-14 07:46:13,"supremeking7",5,"Supreme",121,11
"812","Nike Air Max 1/97 Sean Wotherspoon",600,2019-03-14 07:52:06,"keeseanthony",15,"Nike",580,11
"997","Golf Le Fleur Converse Chuck Taylor",97,2019-03-14 07:57:16,"cprohaska2016",24,"Converse",97,11
"641","Dry Alls jade Green Satin Hat",120,2019-03-14 07:58:13,"acastro1217",5,"Human Made",108,11
"902","Supreme Cat In The Hat Hood Grey",144,2019-03-14 08:04:22,"iGalaxiez",5,"Supreme",152,11
"606","*Brand New* Number (N)ine Hat",87,2019-03-14 08:10:14,"karlmarkusp",112,"Number (N)ine",80,11
"901","*HIGH OFFERS ONLY* Revenge Troubles Hoodie",110,2019-03-14 08:11:25,"joyfulrevenge",139,"Revenge",147,11
"599","Supreme x Stone Island Pocket Tee SS19",180,2019-03-14 08:12:52,"j_premee",139,"Supreme",190,11
"600","Supreme x Stone Island Pocket Tee SS19",180,2019-03-14 08:12:57,"j_premee",140,"Supreme",175,11
"737","The Soloist Hat Size M",50,2019-03-14 08:15:06,"hamsouska",25,"Takahiromiyashita The Soloist.",75,11
"733","Gosha Rubchinskiy Flag Hoodie Grey",180,2019-03-14 08:15:40,"charlesajar3",32,"Gosha Rubchinskiy",165,11
"594","Camo Cargo Vest Coral Camo",850,2019-03-14 08:22:59,"pinkfoliage",231,"Supreme",650,11
"585","Supreme/Stone Island Pocket Tee Black",200,2019-03-14 08:23:15,"silenced_clothing",20,"Supreme",206,11
"845","Supreme backpack ss15",250,2019-03-14 08:24:36,"jawn",3,"Supreme",215,11
"593","Supreme x Stone Island Riot Mask Camo Jacket Black Camo",900,2019-03-14 08:30:48,"vidiotrp",35,"Supreme",860,11
"578","Supreme Handwarmer Camo",40,2019-03-14 08:32:06,"kronknectar",37,"Supreme",45,11
"647","Dries van noten sample T-shirt",121,2019-03-14 08:35:36,"amhendriks97",7,"Dries Van Noten",135,11
"574","Supreme Wolf Fleece Dark Teal Medium",525,2019-03-14 08:40:11,"Elusive",67,"Supreme",500,11
"582","bape x club 75",60,2019-03-14 08:43:19,"goshakami",29,"Bape",61,11
"588","Supreme x Stone island Orange/Coral Camo Boonie Hat M/L",160,2019-03-14 08:43:49,"TurnerHenry",107,"Supreme",154,11
"705","Helmut Lang Scuba Jogger Medium Black Biker Sweatpant Pant",50,2019-03-14 08:44:17,"Rosebeef",145,"Helmut  Lang",50,11
"580","Supreme Felt Logo Beanie",60,2019-03-14 08:46:45,"Strumar",66,"Supreme",75,11
"575","Supreme x Stone Island Pocket Tee SS19",225,2019-03-14 08:46:52,"acrotechwavy",37,"Supreme",190,11
"584","Supreme Stone Island Hoodie (Olive)",520,2019-03-14 08:47:39,"MoneyMag",58,"Supreme",490,11
"568","CHROME HEARTS BLUE STONE CROSS PENDANT",315,2019-03-14 08:50:14,"andrewarteaga",462,"Chrome Hearts",260,11
"596","Supreme Wolf Fleece Jacket Dark Teal Blue Medium",600,2019-03-14 08:50:17,"genericpieces",30,"Supreme",420,11
"598","All Saints Bomber",108,2019-03-14 08:52:27,"HIAWG",9,"Allsaints",80,11
"564","Authentic Fendi Backpack Bag",240,2019-03-14 08:52:36,"AYYGAAGOOO",143,"Fendi",235,11
"589","Supreme / Stone Island Black Boonie Bucket Hat M/L",220,2019-03-14 08:53:58,"fyepiffski",28,"Supreme",205,11
"925","Jumbo Camp Hat | Gray",30,2019-03-14 08:55:34,"supreme_bob",37,"Fuck The Population",40,11
"616","Supreme Stone Island Hoodie",515,2019-03-14 08:56:50,"johanngautier",12,"Supreme",525,11
"587","Stone Island Camo Boonie | Coral Camo Hat",190,2019-03-14 09:02:32,"supreme_bob",38,"Supreme",160,11
"655","AllSaints Leather Biker Bomber Jacket",350,2019-03-14 09:04:47,"thriftstore111",34,"Allsaints",275,11
"866","Palace Polo Zip-Knit",70,2019-03-14 09:13:19,"salvadoreslatt",5,"Palace",85,11
"765","Brocade Gucci Slides",200,2019-03-14 09:13:41,"mitchellmardo",12,"Gucci",180,11
"621","misbhv euphoria leather biker jacket aw17/18",437,2019-03-14 09:27:26,"satperm",47,"Misbhv",400,11
"959","Supreme Rose Mesh Fishing Vest",175,2019-03-14 09:27:38,"cloutmercado",468,"Supreme",150,11
"819","A.P.C. Heavyweight Polo Sweater",145,2019-03-14 09:28:33,"illsander",77,"A.P.C.",100,11
"570","Brand New Imran Potato Spider Hoodie",81,2019-03-14 09:29:59,"matthewwilson",21,"Champion",85,11
"958","Leather jacket Brown Zip up plain Blouson",828,2019-03-14 09:33:13,"Tackyink",130,"Rick Owens",828,11
"550","Tapered Pants Black Virgine Wool Gabardine",365,2019-03-14 09:36:59,"kostinaJunior",1,"Saint Laurent Paris",395,11
"591","Camo Cargo Vest Coral Camo",675,2019-03-14 09:37:43,"DavilsBigAssThumb",120,"Supreme",720,11
"948","GUCCI HIGH NECK ROLL NECK TURTLENECK WOOL SWEATER",214,2019-03-14 09:41:47,"LUNA_RUSSO",840,"Gucci",236,11
"884","Supreme x Nike Crewneck",170,2019-03-14 09:42:45,"cdg_store",3,"Supreme",190,11
"557","White OVO X Jordan Long Sleeve",50,2019-03-14 09:44:30,"rhysmk12",7,"Jordan Brand",40,11
"674","FEAR OF GOD ESSENTIALS SWEATPANTS",150,2019-03-14 09:46:17,"nmshanholtz",17,"Fear of God",140,11
"552","Vertical Logo Stripe Shirt Blue",75,2019-03-14 09:49:24,"ofaneranyc",48,"Supreme",54,11
"766","Supreme Shoulder Bag FW19",105,2019-03-14 09:51:12,"ddp56",21,"Supreme",125,11
"944","Yeezy Season 4 Combat Boot 10 Sand",325,2019-03-14 09:51:15,"cjc918s",1,"Yeezy Season",275,11
"878","Palace Pot T-Shirt Black",28,2019-03-14 09:55:47,"nike_lover89",24,"Palace",38,11
"530","Supreme Nan Goldin Kim in Rhinestones",67,2019-03-14 09:57:24,"beatstreetresell",22,"Supreme",50,11
"544","Supreme Stone Island Hoodie (Olive)",500,2019-03-14 09:57:44,"fontebernstein",19,"Supreme",450,11
"562","PACCBET Tee",54,2019-03-14 10:01:12,"buskpost",6,"Gosha Rubchinskiy",65,11
"566","Napa Face Logo Black And Grey Stripe T Shirt 2017",64,2019-03-14 10:05:02,"bensvfx7",155,"Acne Studios",55,11
"714","Supreme Duffel Bag Large",175,2019-03-14 10:09:33,"damonbradley",7,"Supreme",165,11
"661","Off-white & Goretex",364,2019-03-14 10:10:47,"offstorecz",13,"Off-White",360,11
"511","*LAST DROP* BNWT - Vintage “Y” Tee",175,2019-03-14 10:11:12,"Mgallery",457,"Saint Laurent Paris",187,11
"546","Supreme Navy Felt Logo Beanie",70,2019-03-14 10:14:53,"Vilefiles",12,"Supreme",76,11
"963","A Bathing Ape Army Camo College Logo Shirt Green and Brown",137,2019-03-14 10:16:04,"bapevancouver",79,"Bape",150,11
"540","Supreme Wolf Fleece Jacket Dark Teal Blue Medium",500,2019-03-14 10:17:36,"horiapaul19",7,"Supreme",430,11
"579","Supreme x Cdg split bogo",280,2019-03-14 10:17:40,"eastonmartin",57,"Supreme",250,11
"630","Supreme Old English Bomber Jacket",181,2019-03-14 10:19:20,"pjosiah34",37,"Supreme",150,11
"542","OG RICK OWENS DRKSHDW AIRCUT DENIM SIZE 33",200,2019-03-14 10:20:07,"vandervekenjeff",12,"Rick Owens",230,11
"602","S/S 2018 ""Dirt"" Soultrain Pants",220,2019-03-14 10:20:16,"phonk",395,"Rick Owens",226,11
"962","FOG Essentials Drawstring Shorts ‘Brown’ Fear Of God",56,2019-03-14 10:24:32,"711kevin",366,"Fear of God",60,11
"684","NikeLab ACG Hard Shell Pullover",375,2019-03-14 10:29:31,"ampandy",9,"Nike ACG",340,11
"509","Wolf Fleece Jacket DARK TEAL",450,2019-03-14 10:33:17,"taskforcecam",56,"Supreme",430,11
"688","Supreme Backpack FW18 Black",180,2019-03-14 10:34:52,"Kamau",3,"Supreme",168,11
"506","Supreme flame tee F/W 17 STEAL",55,2019-03-14 10:38:15,"csy18",17,"Supreme",48,11
"531","Supreme x Stone Island Black Camo Boonie M/L",200,2019-03-14 10:39:35,"boywiththebauhaustattoo",309,"Supreme",185,11
"512","Jordan 1 “Shattered Backboard”",324,2019-03-14 10:41:11,"toonami",15,"Jordan Brand",290,11
"780","Supreme SS19 Backpack",158,2019-03-14 10:43:06,"greenseventen",2,"Supreme",166,11
"836","air max 1 anniversary royal blue",200,2019-03-14 10:44:14,"FamousA",26,"Nike",190,11
"838","Authentic Yeezy Boost 350 semi frozen yebra sz 13",300,2019-03-14 10:44:24,"coltonclarke1",31,"Yeezy Boost",285,11
"505","chain jeans",470,2019-03-14 10:44:45,"779l",40,"Amiri",400,11
"485","NikeLab x ACG 2-in-1 System Jacket - Black",999,2019-03-14 10:46:28,"ChromaArchive",301,"Nike ACG",900,11
"486","Supreme Faces Tee Grey",55,2019-03-14 10:49:15,"csy18",18,"Supreme",58,11
"826","Fear of God L/S Tee Fourth Collection",99,2019-03-14 10:49:29,"canadian_heater",11,"Fear of God",119,11
"607","BOYFRIEND HOODIE EXTREMELY RARE",90,2019-03-14 10:50:49,"ethandcardillo",10,"Brockhampton",83,11
"482","Off-White Virgil Abloh Travis Scott ""Merchandise"" Hoodie",539,2019-03-14 10:50:56,"ChromaArchive",300,"Off-White",400,11
"553","Air Max Safari",189,2019-03-14 10:52:47,"OFFTHEMEATRACK",51,"Nike",145,11
"547","Supreme / Stone Island New Silk Light 6-Panel BLACK",90,2019-03-14 10:53:58,"Numoji",12,"Supreme",100,11
"990","Thin Used Cash",85,2019-03-14 10:57:20,"primetime",551,"Acne Studios",85,11
"500","PW Human Race “Pink Glow”",105,2019-03-14 10:58:18,"hendrixxx",34,"Pharrell",95,11
"597","Stone Island Pocket T",250,2019-03-14 10:59:19,"Mxttpdf",13,"Supreme",220,11
"771","Number Nine Mickey Cap",135,2019-03-14 11:00:16,"RemoveClothesStore",184,"Number (N)ine",130,11
"781","Ftp sweatpants",200,2019-03-14 11:00:45,"Xanderftp",3,"Fuck The Population",125,11
"549","Supreme x undercover",64,2019-03-14 11:05:34,"47tx",316,"Supreme",64,11
"498","Rick Owens Mastodon Pro",320,2019-03-14 11:09:24,"ams813",22,"Adidas",308,11
"675","Supreme Shit Camp Hat",50,2019-03-14 11:10:54,"shayyyali",26,"Supreme",50,11
"614","Christian Dior Pouch/Clucth Bag",61,2019-03-14 11:11:00,"therocketpickers",6,"Dior",61,11
"515","Vlone Swarovski Friends tee size medium brand new",220,2019-03-14 11:15:12,"CBMALL",106,"Vlone",225,11
"789","Supreme Dish Towels (set of 3)-Red, Blue, and Black",76,2019-03-14 11:15:47,"7th",93,"Supreme",106,11
"653","Gosha Dj hoodie",130,2019-03-14 11:20:42,"joochanmc",4,"Gosha Rubchinskiy",140,11
"612","Off White Navy Industrial Belt `SS19",180,2019-03-14 11:24:09,"JohnDiagonal",1,"Off-White",135,11
"840","Travis Scott Astroworld Hoodie, Medium",140,2019-03-14 11:26:43,"marshallfoxy",4,"Travis Scott",140,11
"586","“North Stay Black” straight black jeans",115,2019-03-14 11:28:36,"abimartinez808",23,"Acne Studios",85,11
"454","Supreme Group T Shirt",109,2019-03-14 11:29:16,"HypeXpress",48,"Supreme",134,11
"556","Supreme Creeper Tee Black XL SS19",72,2019-03-14 11:30:48,"AndreiBTR",13,"Supreme",112,11
"668","Haider Pink Crushed Velvet Bomber Jacket",656,2019-03-14 11:31:25,"goodnightnibba",255,"Haider Ackermann",500,11
"743","Balenciaga zip off denim",471,2019-03-14 11:32:07,"alfredcollins",166,"Balenciaga",305,11
"507","Bape Long Sleeve Classic Logo Shirt",75,2019-03-14 11:32:17,"csy18",20,"Bape",54,11
"775","ASSC Myself Grey Hoodie",72,2019-03-14 11:36:03,"Chapito",30,"Antisocial Social Club",80,11
"456","Nike X Staple Pigeon Shirt Green",70,2019-03-14 11:36:50,"perseus_cassiopeia_omnis",1,"Nike",80,11
"493","(L) Black Get Weird Long Sleeve Tee ASSC Anti Social Social Club",72,2019-03-14 11:36:54,"SUPAHFAI",2419,"Antisocial Social Club",80,11
"518","Comme des Garcons Shirt Knit Sweater",72,2019-03-14 11:42:54,"buskpost",6,"Comme des Garcons",80,11
"442","Supreme Bling Box Logo Hoodie",150,2019-03-14 11:43:05,"vaqueranogiovani355",3,"Supreme",158,11
"900","Louis Vuitton Belt Black Multicolor Cut Reversible Monogram",233,2019-03-14 11:43:39,"maison433",42,"Louis Vuitton",219,11
"491","WEIRD CAP-PINK ASSC Anti Social Social Club",56,2019-03-14 11:45:28,"SUPAHFAI",2417,"Antisocial Social Club",45,11
"559","Supreme Stone Island Sweatshirt Hoodie Black SS19",550,2019-03-14 11:45:37,"avnerf80",85,"Supreme",590,11
"782","Common Projects Black Original Achilles Mid Sneakers",135,2019-03-14 11:46:22,"matrix492",33,"Common Projects",120,11
"676","Rick Owens Blistered Leather Leggings",202,2019-03-14 11:47:29,"ots",22,"Rick Owens",247,11
"461","Sunglasses",181,2019-03-14 11:49:15,"freedom",829,"Fendi",140,11
"700","Astroworld Season Pass",30,2019-03-14 11:50:13,"chu04",4,"Travis Scott",35,11
"827","Never worn Balenciaga suede boots",250,2019-03-14 11:50:34,"tiagorebello10",87,"Balenciaga",225,11
"699","Art Basel BLACK/PURPLE STAPLE TEE",207,2019-03-14 11:54:01,"diordeluxe",39,"Vlone",210,11
"488","(L) RSVP Pop Up Hoodie ASSC Anti Social Social Club x RSVP GALLERY",129,2019-03-14 11:54:06,"SUPAHFAI",2419,"Rsvp Gallery",110,11
"459","Supreme Christopher Walken King of New York Tee",55,2019-03-14 11:55:00,"georgeg",20,"Supreme",65,11
"476","Vlone Love Tee white",113,2019-03-14 11:55:08,"beko",1,"Vlone",128,11
"489","(L) Gran Turismo Hoodie ASSC Anti Social Social Club",129,2019-03-14 11:55:10,"SUPAHFAI",2419,"Antisocial Social Club",118,11
"581","Astroworld Wish You Were Here Hoodie",144,2019-03-14 11:55:59,"zekrush",12,"Travis Scott",142,11
"777","Bape 1st Camo Shark Sweat Shorts Black Size Small",220,2019-03-14 11:58:48,"hypeplugworldwide",903,"Bape",235,11
"622","UNDERCOVER ""SITH"" T-SHIRT SIZE 4",78,2019-03-14 12:02:49,"mooncat0404",453,"Undercover",83,11
"438","Stone Island Soft Shell - R Navy Jacket",200,2019-03-14 12:04:56,"adamwiltonking2",3,"Stone Island",185,11
"449","ANTI SOCIAL SOCIAL CLUB WHITE BOGO TEE",38,2019-03-14 12:09:33,"NECKONFROZE",409,"Antisocial Social Club",48,11
"572","OVO x Roots Hoodie - Forest Green",100,2019-03-14 12:10:57,"petesjosan",6,"Octobers Very Own",80,11
"451","Supreme Box Logo 20th anniversary",350,2019-03-14 12:12:39,"j_premee",141,"Supreme",360,11
"555","Stone Island Black Crewneck Sweatshirts S/S 2013",162,2019-03-14 12:13:26,"god_bless_me",6,"Stone Island",150,11
"604","Find Some Time Crewneck (Green)",137,2019-03-14 12:14:29,"rossodonoghue2",1,"Golf Wang",157,11
"595","Rugby",130,2019-03-14 12:20:43,"honestly",3,"Polo Ralph Lauren",110,11
"409","Revenge + XXXTENTACION valentine mugshot",85,2019-03-14 12:23:12,"tyler_9106",17,"Revenge",85,11
"431","Supreme shoulder bag black (SS18)",160,2019-03-14 12:23:30,"orangeapple888",6,"Supreme",170,11
"412","Baldwin Scout Tee x2 Vintage Black Optic White $150 Retail",54,2019-03-14 12:24:38,"thatguyjlar",223,"Baldwin",47,11
"871","Surkit L/S",79,2019-03-14 12:24:44,"ha876",116,"Palace",78,11
"968","Supreme Creeper Tee White (SS19)",80,2019-03-14 12:29:08,"minameesmagic",45,"Supreme",94,11
"837","Overdyed Supreme Beanie White SS19",65,2019-03-14 12:30:01,"24kReaper",1,"Supreme",90,11
"694","Early 2000's College Style Bape Zip-Up Hoodie - Olive",109,2019-03-14 12:30:43,"KOLLEKT",325,"Bape",105,11
"750","Supreme box logo crewneck - FW18 - Large",550,2019-03-14 12:30:59,"emillio3198",13,"Supreme",528,11
"446","Palace hardware tee black M",54,2019-03-14 12:31:09,"dsarchives",62,"Palace",51,11
"964","FOG Essentials Drawstring Pants ‘Wild Dove’ Gray Fear Of God",101,2019-03-14 12:33:11,"711kevin",367,"Fear of God",109,11
"928","Nebraska Crewneck",184,2019-03-14 12:34:17,"nvidal65",81,"Off-White",119,11
"625","Louis Vuitton Avenue Sling Bag Damier 100% Authentic",765,2019-03-14 12:36:05,"MAISONBANZ",1,"Louis Vuitton",740,11
"723","ASSC Redeemed Forest Green Hoodie",89,2019-03-14 12:38:25,"AntiSocialClub",343,"Antisocial Social Club",109,11
"806","Louis Vuitton Monogram Lock Pendant on Chain Necklace",125,2019-03-14 12:38:37,"NewportBeach",489,"Louis Vuitton",130,11
"419","BLUE DENIM HIGH RISE CROPPED PANT BRAND NEW FREE US SHIPPING",97,2019-03-14 12:38:42,"BeenGoneVntg",22,"Second/Layer",65,11
"715","SUPREME ""BLING"" BOX LOGO TEE SS13",225,2019-03-14 12:39:40,"cangelo",10,"Supreme",205,11
"858","Astroworld tour nyc exclusive knicks long sleeve tee",144,2019-03-14 12:40:05,"astroworld",97,"Travis Scott",125,11
"545","supreme stone island pocket tee",220,2019-03-14 12:40:06,"cadetomany",10,"Supreme",215,11
"853","Noah NYC Core Logo Beanie",150,2019-03-14 12:40:12,"nicholasschmidt",52,"Noah",130,11
"535","CK Jeans Logo Patch Denim Trucker Jacket",58,2019-03-14 12:42:08,"mnswr_2016",446,"Raf Simons",83,11
"561","Supreme/Stone Island Hooded Sweatshirt",490,2019-03-14 12:44:07,"acquiresupreme",25,"Supreme",470,11
"433","Supreme Stone Island Hooded Sweatshirt Red",490,2019-03-14 12:47:22,"alifiarachman",64,"Supreme",461,11
"483","Fear of God Vans OG 9.5",340,2019-03-14 12:52:15,"tshef60",4,"Vans",260,11
"707","Acne Jeans",79,2019-03-14 12:52:47,"anvtai",12,"Acne Studios",78,11
"950","Bathing ape NY-LA bape store NY13th",64,2019-03-14 12:54:06,"sh0ckwavehd143",9,"Bape",60,11
"522","ASSC x UNDFTD Paranoid Tee M",54,2019-03-14 12:58:28,"IzukuThreads",449,"Undefeated",66,11
"465","Fear of God Anorak",48,2019-03-14 13:00:54,"buchsieb",268,"Pacsun",63,11
"402","AstroWorld Peace hoodie",150,2019-03-14 13:01:51,"Parhum",5,"Travis Scott",155,11
"998","S/S 18 Reworked Panelled Jeans",210,2019-03-14 13:02:10,"scubasteve",894,"Maison Margiela",230,11
"523","Maison Margiela Gat Sneakers",220,2019-03-14 13:03:58,"scubasteve",896,"Maison Margiela",248,11
"424","Raf simons Ozweego Bunny",330,2019-03-14 13:04:02,"felipebarajas67",9,"Adidas",260,11
"389","Fishing Vest",108,2019-03-14 13:05:15,"301hunna",33,"Opening Ceremony",100,11
"708","SS19 Supreme Lock in BLACK",55,2019-03-14 13:05:16,"dnSreme",40,"Supreme",55,11
"473","🔥FINAL PRICE🔥OG CHROME HEARTS HOLLYWOOD PATCH TRUCKER CAPS BLACK X CAMO MADE IN USA",115,2019-03-14 13:07:17,"panjatsocialclubstore",39,"Chrome Hearts",145,11
"943","Air Jordan 11 Cool Grey (2010)",207,2019-03-14 13:13:09,"havenburrola",4,"Jordan Brand",200,11
"469","Supreme® /Stone Island® Camo Backpack - Black Camo",440,2019-03-14 13:13:20,"yjselects",108,"Supreme",395,11
"797","19SS Leda And The Swan Tee",63,2019-03-14 13:14:04,"samueltsai2000",92,"Supreme",60,11
"719","Gold Dolphin Necklace",70,2019-03-14 13:14:09,"friend",947,"Dior",70,11
"372","[M] A BATHING APE BAPE SWAROVSKI CRYSTAL KISS LOGO TEE GREY",123,2019-03-14 13:17:29,"stylisticsjapan_dot_com",743,"Bape",132,11
"752","GNARCOTIC Flame Hoodie",35,2019-03-14 13:18:07,"minilogan2",25,"Fuck The Population",45,11
"497","Comme Des Garçon Converse",70,2019-03-14 13:18:49,"armanlatefi",4,"Converse",78,11
"386","Playboi Carti “RIP” Tour Merch Tee",56,2019-03-14 13:18:51,"kartier",12,"Vlone",64,11
"637","RAF Simons ozweego 3 size 8",225,2019-03-14 13:21:44,"raphaelmontag",9,"Raf Simons",220,11
"471","Supreme Bone Zip Up",137,2019-03-14 13:25:51,"premedaddy98",22,"Supreme",100,11
"423","Siberia Hills x Faze Clan “Anime Warfare” Hoodie",250,2019-03-14 13:26:51,"cleanConsignment",128,"Siberia Hills",270,11
"391","Playboi Carti x Vlone LA Pop Up (BLUE)",186,2019-03-14 13:28:03,"actavis",111,"Vlone",175,11
"527","Monogram Crossbody Shoulder Bag",180,2019-03-14 13:31:59,"mom",4641,"Gucci",130,11
"383","Adidas Ultra Boost Mid Kith x Nonnative",120,2019-03-14 13:32:29,"mpmartinez2424",8,"Adidas",80,11
"760","Hearts Arts & Crafts Denim",220,2019-03-14 13:33:28,"jacksonscarney",67,"Undercover",215,11
"355","Bundle For 2 Preme Tees",110,2019-03-14 13:38:28,"HypePort",261,"Supreme",110,11
"440","Fucking Awesome Logo Hooded Sweatshirt",72,2019-03-14 13:39:34,"davonjl",4,"Fucking Awesome",72,11
"534","New $650 HBA Moto Jeans",200,2019-03-14 13:39:41,"nun",65,"Hood By Air",175,11
"891","Supreme 100 Dollar Bill Gold Pendant 14k",350,2019-03-14 13:39:59,"bryanrosas007",8,"Supreme",270,11
"463","Comme De Garçons Red Jacket Print",234,2019-03-14 13:40:15,"JoeTs",14,"Comme des Garcons",205,11
"416","KAWS BLUE BFF",225,2019-03-14 13:51:45,"jacksonzyskowski",4,"Kaws",185,11
"353","Supreme Creeper Tee White (SS19)",112,2019-03-14 13:52:19,"sfpremeplug",6,"Supreme",108,11
